{
  "name_first": "Jane",
  "name_last": "Doe",
  "email_address": "jane.doe@example.com",
  "phone_number": "2125551234",
  "birth_date": "1990-01-15",
  "document_ssn": "123456789",
  "addresses": [
    {
      "line_1": "123 Main St",
      "city": "New York",
      "state": "NY",
      "zip": "10001",
      "country_code": "US"
    }
  ]
}